{
  "$schema": "https://json-schema.org/draft/2020-12/schema",
  "title": "IPS Scenario",
  "type": "object",
  "required": [
    "id",
    "name",
    "description",
    "overrides"
  ],
  "properties": {
    "id": {
      "type": "string"
    },
    "name": {
      "type": "string"
    },
    "description": {
      "type": "string"
    },
    "overrides": {
      "type": "object",
      "additionalProperties": {
        "type": "number"
      }
    }
  }
}